{
  "schemaVersion": 1,
  "experimentId": "pawnhist-gate-20260912/pawnhist",
  "baselineId": "master",
  "candidateId": "master+pawnhist",
  "elo0": 0.0,
  "elo1": 10.0,
  "alpha": 0.05,
  "beta": 0.05,
  "games": 1236,
  "wins": 481,
  "losses": 552,
  "draws": 203,
  "llr": -2.96,
  "lowerBound": -2.9444,
  "upperBound": 2.9444,
  "boundary": "lower",
  "decision": "reject",
  "pgnSha256": null,
  "provenance": {
    "engineSha": "2c27033f6268333a",
    "netSha": "b23c75b8e25d7480",
    "candArgs": [
      "--futility",
      "--rfp",
      "--tt-prune-store",
      "--qtt",
      "--histmalus",
      "--histlmr",
      "--lmp",
      "--nnue-cal",
      "F:\\Github\\chess-vision-studio-rust-engine\\target-cvs\\eval-cal-20260911.json",
      "--syzygy",
      "F:/tablebases/syzygy345",
      "--pawnhist",
      "nodes=40000",
      "exe="
    ],
    "baseArgs": [
      "--futility",
      "--rfp",
      "--tt-prune-store",
      "--qtt",
      "--histmalus",
      "--histlmr",
      "--lmp",
      "--nnue-cal",
      "F:\\Github\\chess-vision-studio-rust-engine\\target-cvs\\eval-cal-20260911.json",
      "--syzygy",
      "F:/tablebases/syzygy345",
      "nodes=40000",
      "exe="
    ],
    "tc": "nodes:40000",
    "nodes": 40000,
    "threads": 1,
    "openingsSha": "a477672523185ddc",
    "book": "openings-inv1-20260910.epd",
    "bookPositions": 4910,
    "positionsUsed": 660
  }
}
