{
  "schemaVersion": 1,
  "experimentId": "gen11-gate-20260913/gen11",
  "baselineId": "master",
  "candidateId": "master+gen11",
  "elo0": 0.0,
  "elo1": 10.0,
  "alpha": 0.05,
  "beta": 0.05,
  "games": 2820,
  "wins": 1264,
  "losses": 1213,
  "draws": 343,
  "llr": 0.3559,
  "lowerBound": -2.9444,
  "upperBound": 2.9444,
  "boundary": "none",
  "decision": "hold_for_more_data",
  "pgnSha256": null,
  "provenance": {
    "engineSha": "babf20720f25c636",
    "netSha": "b23c75b8e25d7480",
    "candArgs": [
      "--futility",
      "--rfp",
      "--tt-prune-store",
      "--qtt",
      "--histmalus",
      "--histlmr",
      "--lmp",
      "--nnue-cal",
      "F:\\Github\\chess-vision-studio-rust-engine\\target-cvs\\eval-cal-20260911.json",
      "--syzygy",
      "F:/tablebases/syzygy345",
      "nodes=40000",
      "exe="
    ],
    "baseArgs": [
      "--futility",
      "--rfp",
      "--tt-prune-store",
      "--qtt",
      "--histmalus",
      "--histlmr",
      "--lmp",
      "--nnue-cal",
      "F:\\Github\\chess-vision-studio-rust-engine\\target-cvs\\eval-cal-20260911.json",
      "--syzygy",
      "F:/tablebases/syzygy345",
      "nodes=40000",
      "exe="
    ],
    "tc": "nodes:40000",
    "nodes": 40000,
    "threads": 1,
    "openingsSha": "a477672523185ddc",
    "book": "openings-inv1-20260910.epd",
    "bookPositions": 4910,
    "positionsUsed": 1410
  }
}
