{
  "schemaVersion": 1,
  "experimentId": "delta-big-gate-20260910/delta",
  "baselineId": "master",
  "candidateId": "master+delta",
  "elo0": 0.0,
  "elo1": 10.0,
  "alpha": 0.05,
  "beta": 0.05,
  "games": 1201,
  "wins": 477,
  "losses": 550,
  "draws": 174,
  "llr": -2.964,
  "lowerBound": -2.9444,
  "upperBound": 2.9444,
  "boundary": "lower",
  "decision": "reject",
  "pgnSha256": null,
  "provenance": {
    "engineSha": "e620d4cd4c6cd7cd",
    "netSha": "b23c75b8e25d7480",
    "candArgs": [
      "--futility",
      "--rfp",
      "--tt-prune-store",
      "--qtt",
      "--histmalus",
      "--histlmr",
      "--lmp",
      "--delta",
      "nodes=40000",
      "exe=chess-vision-studio-rust-engine-gatefix"
    ],
    "baseArgs": [
      "--futility",
      "--rfp",
      "--tt-prune-store",
      "--qtt",
      "--histmalus",
      "--histlmr",
      "--lmp",
      "nodes=40000",
      "exe=chess-vision-studio-rust-engine-gatefix"
    ],
    "tc": "nodes:40000",
    "nodes": 40000,
    "threads": 1,
    "openingsSha": "a477672523185ddc",
    "book": "openings-inv1-20260910.epd",
    "bookPositions": 4910,
    "positionsUsed": 660
  }
}
