{
  "schemaVersion": 1,
  "experimentId": "seeprune-regate-hp-20260910/seeprune-regate",
  "baselineId": "master",
  "candidateId": "master+seeprune-regate",
  "elo0": 0.0,
  "elo1": 10.0,
  "alpha": 0.05,
  "beta": 0.05,
  "games": 2748,
  "wins": 1148,
  "losses": 1199,
  "draws": 401,
  "llr": -2.9585,
  "lowerBound": -2.9444,
  "upperBound": 2.9444,
  "boundary": "lower",
  "decision": "reject",
  "pgnSha256": null,
  "provenance": {
    "engineSha": "021bca45a830ed90",
    "netSha": "b23c75b8e25d7480",
    "candArgs": [
      "--futility",
      "--rfp",
      "--tt-prune-store",
      "--qtt",
      "--histmalus",
      "--histlmr",
      "--lmp",
      "--syzygy",
      "F:/tablebases/syzygy345",
      "nodes=40000",
      "exe=chess-vision-studio-rust-engine"
    ],
    "baseArgs": [
      "--futility",
      "--rfp",
      "--tt-prune-store",
      "--qtt",
      "--histmalus",
      "--histlmr",
      "--lmp",
      "--syzygy",
      "F:/tablebases/syzygy345",
      "--no-seeprune",
      "nodes=40000",
      "exe=chess-vision-studio-rust-engine"
    ],
    "tc": "nodes:40000",
    "nodes": 40000,
    "threads": 1,
    "openingsSha": "a477672523185ddc",
    "book": "openings-inv1-20260910.epd",
    "bookPositions": 4910,
    "positionsUsed": 1380
  }
}
