{
  "schemaVersion": 1,
  "experimentId": "lmp-regate-hp-20260910/lmp-regate",
  "baselineId": "master",
  "candidateId": "master+lmp-regate",
  "elo0": 0.0,
  "elo1": 10.0,
  "alpha": 0.05,
  "beta": 0.05,
  "games": 515,
  "wins": 271,
  "losses": 174,
  "draws": 70,
  "llr": 2.948,
  "lowerBound": -2.9444,
  "upperBound": 2.9444,
  "boundary": "upper",
  "decision": "promote",
  "pgnSha256": null,
  "provenance": {
    "engineSha": "021bca45a830ed90",
    "netSha": "b23c75b8e25d7480",
    "candArgs": [
      "--futility",
      "--rfp",
      "--tt-prune-store",
      "--qtt",
      "--histmalus",
      "--histlmr",
      "--lmp",
      "--syzygy",
      "F:/tablebases/syzygy345",
      "nodes=40000",
      "exe=chess-vision-studio-rust-engine"
    ],
    "baseArgs": [
      "--futility",
      "--rfp",
      "--tt-prune-store",
      "--qtt",
      "--histmalus",
      "--histlmr",
      "--lmp",
      "--syzygy",
      "F:/tablebases/syzygy345",
      "--no-lmp",
      "nodes=40000",
      "exe=chess-vision-studio-rust-engine"
    ],
    "tc": "nodes:40000",
    "nodes": 40000,
    "threads": 1,
    "openingsSha": "a477672523185ddc",
    "book": "openings-inv1-20260910.epd",
    "bookPositions": 4910,
    "positionsUsed": 300
  }
}
