{
  "schemaVersion": 1,
  "experimentId": "lmrdiv20-gate-20260910/lmrdiv20",
  "baselineId": "master",
  "candidateId": "master+lmrdiv20",
  "elo0": 0.0,
  "elo1": 10.0,
  "alpha": 0.05,
  "beta": 0.05,
  "games": 1798,
  "wins": 741,
  "losses": 786,
  "draws": 271,
  "llr": -2.3279,
  "lowerBound": -2.9444,
  "upperBound": 2.9444,
  "boundary": "none",
  "decision": "hold_for_more_data",
  "pgnSha256": null,
  "provenance": {
    "engineSha": "c4ba3c620c796c8c",
    "netSha": "b23c75b8e25d7480",
    "candArgs": [
      "--futility",
      "--rfp",
      "--tt-prune-store",
      "--qtt",
      "--histmalus",
      "--histlmr",
      "--lmp",
      "--loglmr",
      "--lmr-div",
      "2.0",
      "nodes=40000",
      "exe=chess-vision-studio-rust-engine-gatefix"
    ],
    "baseArgs": [
      "--futility",
      "--rfp",
      "--tt-prune-store",
      "--qtt",
      "--histmalus",
      "--histlmr",
      "--lmp",
      "nodes=40000",
      "exe=chess-vision-studio-rust-engine-gatefix"
    ],
    "tc": "nodes:40000",
    "nodes": 40000,
    "threads": 1,
    "openingsSha": "7833d53282282e1c",
    "book": "openings-inv1-20260909b.epd",
    "bookPositions": 2099,
    "positionsUsed": 899
  }
}
