{
  "schemaVersion": 1,
  "experimentId": "inv1-ladder-20260909/countermove",
  "baselineId": "master",
  "candidateId": "master+countermove",
  "elo0": 0.0,
  "elo1": 10.0,
  "alpha": 0.05,
  "beta": 0.05,
  "games": 517,
  "wins": 193,
  "losses": 280,
  "draws": 44,
  "llr": -2.9539,
  "lowerBound": -2.9444,
  "upperBound": 2.9444,
  "boundary": "lower",
  "decision": "reject",
  "pgnSha256": null,
  "provenance": {
    "engineSha": "b762b7c0c8435b82",
    "netSha": "b23c75b8e25d7480",
    "candArgs": [
      "--futility",
      "--rfp",
      "--tt-prune-store",
      "--qtt",
      "--histmalus",
      "--histlmr",
      "--lmp",
      "--countermove",
      "nodes=40000",
      "exe=chess-vision-studio-rust-engine-ladder"
    ],
    "baseArgs": [
      "--futility",
      "--rfp",
      "--tt-prune-store",
      "--qtt",
      "--histmalus",
      "--histlmr",
      "--lmp",
      "nodes=40000",
      "exe=chess-vision-studio-rust-engine-ladder"
    ],
    "tc": "nodes:40000",
    "nodes": 40000,
    "threads": 1,
    "openingsSha": "9fb74795c5c93174"
  }
}
