{
  "schemaVersion": 1,
  "experimentId": "nnuecal-gate-20260911/nnuecal",
  "baselineId": "master",
  "candidateId": "master+nnuecal",
  "elo0": 0.0,
  "elo1": 10.0,
  "alpha": 0.05,
  "beta": 0.05,
  "games": 1000,
  "wins": 479,
  "losses": 375,
  "draws": 146,
  "llr": 2.9709,
  "lowerBound": -2.9444,
  "upperBound": 2.9444,
  "boundary": "upper",
  "decision": "promote",
  "pgnSha256": null,
  "provenance": {
    "engineSha": "13bb142bf7736f88",
    "netSha": "b23c75b8e25d7480",
    "candArgs": [
      "--futility",
      "--rfp",
      "--tt-prune-store",
      "--qtt",
      "--histmalus",
      "--histlmr",
      "--lmp",
      "--syzygy",
      "F:/tablebases/syzygy345",
      "--nnue-cal",
      "F:\\Github\\chess-vision-studio-rust-engine\\target-cvs\\eval-cal-20260911.json",
      "nodes=40000",
      "exe="
    ],
    "baseArgs": [
      "--futility",
      "--rfp",
      "--tt-prune-store",
      "--qtt",
      "--histmalus",
      "--histlmr",
      "--lmp",
      "--syzygy",
      "F:/tablebases/syzygy345",
      "nodes=40000",
      "exe="
    ],
    "tc": "nodes:40000",
    "nodes": 40000,
    "threads": 1,
    "openingsSha": "a477672523185ddc",
    "book": "openings-inv1-20260910.epd",
    "bookPositions": 4910,
    "positionsUsed": 540
  }
}
