{
  "schemaVersion": 1,
  "experimentId": "nnuecal-sfprune-gate-20260911/nnuecal-sfprune",
  "baselineId": "master",
  "candidateId": "master+nnuecal-sfprune",
  "elo0": 0.0,
  "elo1": 10.0,
  "alpha": 0.05,
  "beta": 0.05,
  "games": 1500,
  "wins": 643,
  "losses": 641,
  "draws": 216,
  "llr": -0.6301,
  "lowerBound": -2.9444,
  "upperBound": 2.9444,
  "boundary": "none",
  "decision": "hold_for_more_data",
  "pgnSha256": null,
  "provenance": {
    "engineSha": "13bb142bf7736f88",
    "netSha": "b23c75b8e25d7480",
    "candArgs": [
      "--futility",
      "--rfp",
      "--tt-prune-store",
      "--qtt",
      "--histmalus",
      "--histlmr",
      "--lmp",
      "--nnue-cal",
      "F:\\Github\\chess-vision-studio-rust-engine\\target-cvs\\eval-cal-20260911.json",
      "--syzygy",
      "F:/tablebases/syzygy345",
      "--nnue-cal",
      "F:\\Github\\chess-vision-studio-rust-engine\\target-cvs\\eval-cal-20260911.json",
      "--sfprune",
      "--sfnull",
      "nodes=40000",
      "exe="
    ],
    "baseArgs": [
      "--futility",
      "--rfp",
      "--tt-prune-store",
      "--qtt",
      "--histmalus",
      "--histlmr",
      "--lmp",
      "--nnue-cal",
      "F:\\Github\\chess-vision-studio-rust-engine\\target-cvs\\eval-cal-20260911.json",
      "--syzygy",
      "F:/tablebases/syzygy345",
      "nodes=40000",
      "exe="
    ],
    "tc": "nodes:40000",
    "nodes": 40000,
    "threads": 1,
    "openingsSha": "a477672523185ddc",
    "book": "openings-inv1-20260910.epd",
    "bookPositions": 4910,
    "positionsUsed": 750
  }
}
