{
  "schemaVersion": 1,
  "experimentId": "rootsafequiet-gate-20260909/rootsafequiet",
  "baselineId": "master",
  "candidateId": "master+rootsafequiet",
  "elo0": 0.0,
  "elo1": 10.0,
  "alpha": 0.05,
  "beta": 0.05,
  "games": 2000,
  "wins": 855,
  "losses": 849,
  "draws": 296,
  "llr": -0.7318,
  "lowerBound": -2.9444,
  "upperBound": 2.9444,
  "boundary": "none",
  "decision": "hold_for_more_data",
  "pgnSha256": null,
  "provenance": {
    "engineSha": "2de995103917d2ea",
    "netSha": "b23c75b8e25d7480",
    "candArgs": [
      "--futility",
      "--rfp",
      "--tt-prune-store",
      "--qtt",
      "--histmalus",
      "--histlmr",
      "--lmp",
      "--rootsafequiet",
      "nodes=40000",
      "exe=chess-vision-studio-rust-engine-gatefix"
    ],
    "baseArgs": [
      "--futility",
      "--rfp",
      "--tt-prune-store",
      "--qtt",
      "--histmalus",
      "--histlmr",
      "--lmp",
      "nodes=40000",
      "exe=chess-vision-studio-rust-engine-gatefix"
    ],
    "tc": "nodes:40000",
    "nodes": 40000,
    "threads": 1,
    "openingsSha": "7833d53282282e1c",
    "book": "openings-inv1-20260909b.epd",
    "bookPositions": 2099,
    "positionsUsed": 1000
  }
}
