{
  "schemaVersion": 1,
  "experimentId": "bundle-regate-20260909/bundle-inv1",
  "baselineId": "master",
  "candidateId": "master+bundle-inv1",
  "elo0": 0.0,
  "elo1": 10.0,
  "alpha": 0.05,
  "beta": 0.05,
  "games": 2000,
  "wins": 852,
  "losses": 816,
  "draws": 332,
  "llr": 0.269,
  "lowerBound": -2.9444,
  "upperBound": 2.9444,
  "boundary": "none",
  "decision": "hold_for_more_data",
  "pgnSha256": null,
  "provenance": {
    "engineSha": "9e3d5642dbfe5426",
    "netSha": "b23c75b8e25d7480",
    "candArgs": [
      "--futility",
      "--rfp",
      "--tt-prune-store",
      "--qtt",
      "--histmalus",
      "--histlmr",
      "--lmp",
      "nodes=40000",
      "exe=chess-vision-studio-rust-engine-gatefix"
    ],
    "baseArgs": [
      "--futility",
      "--rfp",
      "--tt-prune-store",
      "--qtt",
      "--histmalus",
      "--histlmr",
      "--lmp",
      "--no-caphist",
      "--no-improving",
      "--no-king-activity",
      "--no-seeprune",
      "--no-tt2",
      "nodes=40000",
      "exe=chess-vision-studio-rust-engine-gatefix"
    ],
    "tc": "nodes:40000",
    "nodes": 40000,
    "threads": 1,
    "openingsSha": "b25d484dffa91514",
    "book": "openings-inv1-20260909.epd",
    "bookPositions": 2019,
    "positionsUsed": 1000
  }
}
