{
  "schemaVersion": 1,
  "experimentId": "smallpos-bundle-gate-20260910/smallpos-bundle",
  "baselineId": "master",
  "candidateId": "master+smallpos-bundle",
  "elo0": 0.0,
  "elo1": 10.0,
  "alpha": 0.05,
  "beta": 0.05,
  "games": 1725,
  "wins": 785,
  "losses": 672,
  "draws": 268,
  "llr": 2.9545,
  "lowerBound": -2.9444,
  "upperBound": 2.9444,
  "boundary": "upper",
  "decision": "promote",
  "pgnSha256": null,
  "provenance": {
    "engineSha": "e620d4cd4c6cd7cd",
    "netSha": "b23c75b8e25d7480",
    "candArgs": [
      "--futility",
      "--rfp",
      "--tt-prune-store",
      "--qtt",
      "--histmalus",
      "--histlmr",
      "--lmp",
      "--delta",
      "--conthist",
      "nodes=40000",
      "exe=chess-vision-studio-rust-engine-gatefix"
    ],
    "baseArgs": [
      "--futility",
      "--rfp",
      "--tt-prune-store",
      "--qtt",
      "--histmalus",
      "--histlmr",
      "--lmp",
      "nodes=40000",
      "exe=chess-vision-studio-rust-engine-gatefix"
    ],
    "tc": "nodes:40000",
    "nodes": 40000,
    "threads": 1,
    "openingsSha": "a477672523185ddc",
    "book": "openings-inv1-20260910.epd",
    "bookPositions": 4910,
    "positionsUsed": 900
  }
}
